{
  "schema_version": "2.6.3",
  "registry_version": "2026-08-13-free-web-route-registry-v1",
  "acquisition_method": "CODEX_WEB",
  "route_acceptance_sessions_required": 5,
  "suspend_after_consecutive_failures": 3,
  "automatic_promotion_allowed": false,
  "routes": [
    {
      "route_id": "NBIS_NASDAQ_HISTORICAL",
      "ticker_scope": ["NBIS"],
      "exchange_scope": ["NASDAQ"],
      "instrument_class_scope": ["stock"],
      "source_type": "OFFICIAL_LISTING_MARKET_CLOSE",
      "source_domain": "nasdaq.com",
      "source_url_template": "https://www.nasdaq.com/market-activity/stocks/nbis/historical",
      "price_basis": "OFFICIAL_LISTING_MARKET_CLOSE",
      "source_field_label": "Close",
      "currency": "USD",
      "authentication_requirement": "NONE",
      "route_status": "SOURCE_ROUTE_PENDING_REVIEW",
      "accepted_sessions": [],
      "last_success": null,
      "last_failure": null,
      "consecutive_failures": 0,
      "route_fingerprint": "c93c2391e73cd78ad8c7396f44c79b1676b27d5b68c0a60253cdefaf845be493",
      "notes": "Generic Nasdaq historical-page candidate. It is not labeled NOCP unless the exact field semantics are independently proven.",
      "order_authority": false
    },
    {
      "route_id": "MVLL_NASDAQ_HISTORICAL",
      "ticker_scope": ["MVLL"],
      "exchange_scope": ["NASDAQ"],
      "instrument_class_scope": ["leveraged_etf"],
      "source_type": "OFFICIAL_LISTING_MARKET_CLOSE",
      "source_domain": "nasdaq.com",
      "source_url_template": "https://www.nasdaq.com/market-activity/etf/mvll/historical",
      "price_basis": "OFFICIAL_LISTING_MARKET_CLOSE",
      "source_field_label": "Close",
      "currency": "USD",
      "authentication_requirement": "NONE",
      "route_status": "SOURCE_ROUTE_PENDING_REVIEW",
      "accepted_sessions": [],
      "last_success": null,
      "last_failure": null,
      "consecutive_failures": 0,
      "route_fingerprint": "ce608cc8d0ecca853a3cdd2e5a8bb2ac26daba967d18f4d6d74be9fe635a8e74",
      "notes": "Direct MVLL evidence candidate; MRVL is never a substitute for this route.",
      "order_authority": false
    },
    {
      "route_id": "MVLL_GRANITESHARES",
      "ticker_scope": ["MVLL"],
      "exchange_scope": ["NASDAQ"],
      "instrument_class_scope": ["leveraged_etf"],
      "source_type": "ETF_SPONSOR_MARKET_CLOSE",
      "source_domain": "graniteshares.com",
      "source_url_template": "https://graniteshares.com/institutional/us/en-us/etfs/mvll/",
      "price_basis": "ETF_SPONSOR_MARKET_CLOSE",
      "source_field_label": "Market Price",
      "currency": "USD",
      "authentication_requirement": "NONE",
      "route_status": "SOURCE_ROUTE_PENDING_REVIEW",
      "accepted_sessions": [],
      "last_success": null,
      "last_failure": null,
      "consecutive_failures": 0,
      "route_fingerprint": "41a459ac71abc0f478d546cd51b179596712e28e997d764c4218a0b52c052c8d",
      "notes": "Sponsor candidate; market-price versus NAV semantics must be explicit before acceptance.",
      "order_authority": false
    },
    {
      "route_id": "FSLY_FASTLY_IR",
      "ticker_scope": ["FSLY"],
      "exchange_scope": ["NYSE"],
      "instrument_class_scope": ["stock"],
      "source_type": "ISSUER_IR_HISTORICAL_PRICE",
      "source_domain": "investors.fastly.com",
      "source_url_template": "https://investors.fastly.com/stock-information/historical-price-lookup",
      "price_basis": "ISSUER_IR_REPORTED_CLOSE",
      "source_field_label": "Close",
      "currency": "USD",
      "authentication_requirement": "NONE",
      "route_status": "SOURCE_ROUTE_PENDING_REVIEW",
      "accepted_sessions": [],
      "last_success": null,
      "last_failure": null,
      "consecutive_failures": 0,
      "route_fingerprint": "458b55089ad34d03e317c627722c20e2e182682ce18bc301aec65fa88abbfce0",
      "notes": "Issuer IR candidate; dated record and close semantics remain subject to five-session acceptance.",
      "order_authority": false
    },
    {
      "route_id": "FSLY_NASDAQ_HISTORICAL",
      "ticker_scope": ["FSLY"],
      "exchange_scope": ["NYSE"],
      "instrument_class_scope": ["stock"],
      "source_type": "INDEPENDENT_NON_YAHOO_MARKET_PAGE",
      "source_domain": "nasdaq.com",
      "source_url_template": "https://www.nasdaq.com/market-activity/stocks/fsly/historical",
      "price_basis": "CONSOLIDATED_REGULAR_SESSION_CLOSE",
      "source_field_label": "Close",
      "currency": "USD",
      "authentication_requirement": "NONE",
      "route_status": "SOURCE_ROUTE_PENDING_REVIEW",
      "accepted_sessions": [],
      "last_success": null,
      "last_failure": null,
      "consecutive_failures": 0,
      "route_fingerprint": "c66282e51348dad895b6cf8cef2d8fe5428e07e8a14c4d854288e613ff2391f1",
      "notes": "Separate generic historical route; not NOCP and not listing-market authoritative for FSLY.",
      "order_authority": false
    },
    {
      "route_id": "BE_BLOOM_IR",
      "ticker_scope": ["BE"],
      "exchange_scope": ["NYSE"],
      "instrument_class_scope": ["stock"],
      "source_type": "ISSUER_IR_HISTORICAL_PRICE",
      "source_domain": "investor.bloomenergy.com",
      "source_url_template": "https://investor.bloomenergy.com/stock-information/historical-price-lookup",
      "price_basis": "ISSUER_IR_REPORTED_CLOSE",
      "source_field_label": "Close",
      "currency": "USD",
      "authentication_requirement": "NONE",
      "route_status": "SOURCE_ROUTE_PENDING_REVIEW",
      "accepted_sessions": [],
      "last_success": null,
      "last_failure": null,
      "consecutive_failures": 0,
      "route_fingerprint": "e6ce3599357ee96594f1f8384277b61e9b4da204be5493bbd17bf02018360e26",
      "notes": "Issuer IR candidate; accessibility and field semantics are not yet operationally accepted.",
      "order_authority": false
    },
    {
      "route_id": "TOST_TOAST_IR",
      "ticker_scope": ["TOST"],
      "exchange_scope": ["NYSE"],
      "instrument_class_scope": ["stock"],
      "source_type": "ISSUER_IR_HISTORICAL_PRICE",
      "source_domain": "investors.toasttab.com",
      "source_url_template": "https://investors.toasttab.com/stock-information/historical-price-lookup",
      "price_basis": "ISSUER_IR_REPORTED_CLOSE",
      "source_field_label": "Close",
      "currency": "USD",
      "authentication_requirement": "NONE",
      "route_status": "SOURCE_ROUTE_PENDING_REVIEW",
      "accepted_sessions": [],
      "last_success": null,
      "last_failure": null,
      "consecutive_failures": 0,
      "route_fingerprint": "5e34fee437802b75d4c5fe5361168aa0f8749198cd023c9495d26dd5f0dc1b29",
      "notes": "Issuer IR candidate; remains pending until exact dated close records pass acceptance.",
      "order_authority": false
    },
    {
      "route_id": "SOXL_DIREXION",
      "ticker_scope": ["SOXL"],
      "exchange_scope": ["NYSE_ARCA"],
      "instrument_class_scope": ["leveraged_etf"],
      "source_type": "ETF_SPONSOR_MARKET_CLOSE",
      "source_domain": "direxion.com",
      "source_url_template": "https://www.direxion.com/product/daily-semiconductor-bull-bear-3x-etfs",
      "price_basis": "ETF_SPONSOR_MARKET_CLOSE",
      "source_field_label": "Market Price",
      "currency": "USD",
      "authentication_requirement": "NONE",
      "route_status": "SOURCE_ROUTE_PENDING_REVIEW",
      "accepted_sessions": [],
      "last_success": null,
      "last_failure": null,
      "consecutive_failures": 0,
      "route_fingerprint": "add7201ae3034103866e5db447c432f3b4ec9f786837d55218e68ce8bc7c3605",
      "notes": "Direct SOXL sponsor candidate; market price must be separated from NAV.",
      "order_authority": false
    },
    {
      "route_id": "SOXL_NASDAQ_HISTORICAL",
      "ticker_scope": ["SOXL"],
      "exchange_scope": ["NYSE_ARCA"],
      "instrument_class_scope": ["leveraged_etf"],
      "source_type": "INDEPENDENT_NON_YAHOO_MARKET_PAGE",
      "source_domain": "nasdaq.com",
      "source_url_template": "https://www.nasdaq.com/market-activity/etf/soxl/historical",
      "price_basis": "CONSOLIDATED_REGULAR_SESSION_CLOSE",
      "source_field_label": "Close",
      "currency": "USD",
      "authentication_requirement": "NONE",
      "route_status": "SOURCE_ROUTE_PENDING_REVIEW",
      "accepted_sessions": [],
      "last_success": null,
      "last_failure": null,
      "consecutive_failures": 0,
      "route_fingerprint": "474e58eab6ca5269f6c31785a4de710f016291545b8ab0dad09c19f256ae7193",
      "notes": "Separate generic historical route; direct SOXL identity is required and it is not NOCP.",
      "order_authority": false
    },
    {
      "route_id": "NOW_SERVICENOW_IR",
      "ticker_scope": ["NOW"],
      "exchange_scope": ["NYSE"],
      "instrument_class_scope": ["stock"],
      "source_type": "ISSUER_IR_HISTORICAL_PRICE",
      "source_domain": "investors.servicenow.com",
      "source_url_template": "https://investors.servicenow.com/stock-information/historical-price-lookup",
      "price_basis": "ISSUER_IR_REPORTED_CLOSE",
      "source_field_label": "Close",
      "currency": "USD",
      "authentication_requirement": "NONE",
      "route_status": "SOURCE_ROUTE_PENDING_REVIEW",
      "accepted_sessions": [],
      "last_success": null,
      "last_failure": null,
      "consecutive_failures": 0,
      "route_fingerprint": "1d6bfbc075a7f0602362f35a2fff6de1a82857fc5356fdd4f8e890b115b2cf1f",
      "notes": "Issuer IR candidate; remains pending until dated field semantics pass acceptance.",
      "order_authority": false
    },
    {
      "route_id": "NOW_NASDAQ_HISTORICAL",
      "ticker_scope": ["NOW"],
      "exchange_scope": ["NYSE"],
      "instrument_class_scope": ["stock"],
      "source_type": "INDEPENDENT_NON_YAHOO_MARKET_PAGE",
      "source_domain": "nasdaq.com",
      "source_url_template": "https://www.nasdaq.com/market-activity/stocks/now/historical",
      "price_basis": "CONSOLIDATED_REGULAR_SESSION_CLOSE",
      "source_field_label": "Close",
      "currency": "USD",